subreddit,id,title,author,created_utc,permalink,url,score,num_comments,search_term,snippet,matched_keywords,relevance_score
Fishing,1dm3fok,"Was gifted all of this gear, what can I catch ",Nancypicks,2024-06-22 13:27:41,https://reddit.com/r/Fishing/comments/1dm3fok/was_gifted_all_of_this_gear_what_can_i_catch/,https://www.reddit.com/gallery/1dm3fok,163,90,Akash Fishmeal & Fish Oil Private Limited,,catch,55.46444444444444
environment,stmv0q,"Fish oil and fishmeal industry harming food security in west Africa, warns UN",hillarioushillary,2022-02-15 21:26:57,https://reddit.com/r/environment/comments/stmv0q/fish_oil_and_fishmeal_industry_harming_food/,https://www.theguardian.com/environment/2022/feb/10/fish-oil-and-fishmeal-industry-harming-food-security-in-west-africa-warns-un,20,7,Akash Fishmeal & Fish Oil Private Limited,,"fishmeal, fish oil",55.02222222222222
science,jt3kgm,"Microalgae-blend tilapia feed eliminates fishmeal and fish oil, improves growth, and is cost viable",Harry-le-Roy,2020-11-12 14:23:40,https://reddit.com/r/science/comments/jt3kgm/microalgaeblend_tilapia_feed_eliminates_fishmeal/,https://www.nature.com/articles/s41598-020-75289-x,195,1,Akash Fishmeal & Fish Oil Private Limited,,"fishmeal, fish oil",54.5
science,de5rfs,"People who received omega-3 fish oil supplements in randomized clinical trials had lower risks of heart attack & other cardiovascular disease (CVD) events compared with those who were given placebo, according to a meta-analysis from Harvard T.H. Chan School of Public Health & Brigham & Women's hos.",MistWeaver80,2019-10-06 10:48:21,https://reddit.com/r/science/comments/de5rfs/people_who_received_omega3_fish_oil_supplements/,https://www.ahajournals.org/doi/10.1161/JAHA.119.013543,904,56,Akash Fishmeal & Fish Oil Private Limited,,fish oil,52.0
worldnews,v6dxm,"""Australia will create the largest network of marine parks in the world, protecting waters covering an area as large as India while banning oil and gas exploration and limiting commercial fishing in some of the most sensitive areas.""",trot-trot,2012-06-17 07:30:15,https://reddit.com/r/worldnews/comments/v6dxm/australia_will_create_the_largest_network_of/,http://www.reuters.com/article/2012/06/14/us-australia-environment-marine-idUSBRE85D02Y20120614,3013,721,Akash Fishmeal & Fish Oil Private Limited,,commercial fishing,46.0
environment,afva3,"A Fish Oil Story - more about the loss of ""The Most Important Fish in the Sea""",ricemilk,2009-12-17 13:29:25,https://reddit.com/r/environment/comments/afva3/a_fish_oil_story_more_about_the_loss_of_the_most/,https://www.reddit.com/r/environment/comments/afva3/a_fish_oil_story_more_about_the_loss_of_the_most/,22,0,Akash Fishmeal & Fish Oil Private Limited,,"fish oil, catch, processing plant",44.879999999999995
science,r3hmya,"Production costs of protein feed for farmed fish using methanotrophic microbes and methane from U.S. wastewater treatment plants, landfills and oil/gas facilities are lower than the current cost of fishmeal. With 20% cost reductions, stranded methane from the U.S. can satisfy global fishmeal demand.",Litvi,2021-11-27 09:58:19,https://reddit.com/r/science/comments/r3hmya/production_costs_of_protein_feed_for_farmed_fish/,https://news.stanford.edu/press-releases/2021/11/22/turning-climate-em-food-solution/,69,4,Akash Fishmeal & Fish Oil Private Limited,,fishmeal,42.882222222222225
investing,3gcjtt,Let's take a look at Bakkafrost (my third analysis),ScandinavianValue,2015-08-09 07:36:47,https://reddit.com/r/investing/comments/3gcjtt/lets_take_a_look_at_bakkafrost_my_third_analysis/,https://www.reddit.com/r/investing/comments/3gcjtt/lets_take_a_look_at_bakkafrost_my_third_analysis/,105,42,Akash Fishmeal & Fish Oil Private Limited,,"fish oil, catch, processing plant, fishing industry, marine harvest, seafood",40.2
environment,u4a6g,"How Industrial Farms on Land are Destroying the Ocean - 31% of fishmeal is going specifically to feed pigs & 9% to chickens. It's recommended  forage-fish catches be cut by 1/2, arguing that  tuna, striped bass & bluefish are being undermined while propping up unsustainable livestock production",anutensil,2012-05-25 04:27:47,https://reddit.com/r/environment/comments/u4a6g/how_industrial_farms_on_land_are_destroying_the/,http://www.wired.com/wiredscience/2012/05/cooking-solutions-monterey/,29,2,Akash Fishmeal & Fish Oil Private Limited,,"fishmeal, catch",39.96
sustainability,124w4jr,This Week's Positive Climate News,AnonymusWaterBuffalo,2023-03-28 11:31:47,https://reddit.com/r/sustainability/comments/124w4jr/this_weeks_positive_climate_news/,https://www.reddit.com/r/sustainability/comments/124w4jr/this_weeks_positive_climate_news/,364,17,Australian Fishmeal Company,,fishing industry,37.922222222222224
investing,17xg92p,Where Have All the Foreign Buyers Gone for U.S. Treasury Debt?,iamlookingtomakemone,2023-11-17 07:27:11,https://reddit.com/r/investing/comments/17xg92p/where_have_all_the_foreign_buyers_gone_for_us/,https://www.reddit.com/r/investing/comments/17xg92p/where_have_all_the_foreign_buyers_gone_for_us/,169,161,Akash Fishmeal & Fish Oil Private Limited,,none,33.282222222222224
science,1ik3xp,"study finds derivative of fish oil can prevent nerve pain, offering potential natural pain-prevention treatment for nerve-based health & pain problems",purvec,2013-07-18 07:50:16,https://reddit.com/r/science/comments/1ik3xp/study_finds_derivative_of_fish_oil_can_prevent/,http://www.eurekalert.org/pub_releases/2013-07/du-uah071713.php,18,1,Akash Fishmeal & Fish Oil Private Limited,,fish oil,33.120000000000005
investing,qrtkox,Understanding and Profiting from our Current Inflationary Environment,StockTipsTips,2021-11-11 12:57:56,https://reddit.com/r/investing/comments/qrtkox/understanding_and_profiting_from_our_current/,https://www.reddit.com/r/investing/comments/qrtkox/understanding_and_profiting_from_our_current/,393,200,Akash Fishmeal & Fish Oil Private Limited,,none,32.34444444444445
worldnews,vmi9g,"Fears Accompany Fishermen in Japanese Disaster Region - The catch from 6 boats, the 1st to resume commercial fishing off Fukushima, went on sale at local supermarkets. For now, the catch is limited to octopus & whelk, since they're thought to trap fewer radioactive particles.",anutensil,2012-06-26 05:41:45,https://reddit.com/r/worldnews/comments/vmi9g/fears_accompany_fishermen_in_japanese_disaster/,http://www.nytimes.com/2012/06/26/world/asia/fears-accompany-fishermen-in-japanese-disaster-region.html?_r=1&partner=rss&emc=rss,5,0,Akash Fishmeal & Fish Oil Private Limited,,"commercial fishing, catch",32.2
maritime,1ijv825,Why are there so few seafaring jobs in Australia in 2025?,Joey_Nuwanda,2025-02-07 06:40:55,https://reddit.com/r/maritime/comments/1ijv825/why_are_there_so_few_seafaring_jobs_in_australia/,https://www.reddit.com/r/maritime/comments/1ijv825/why_are_there_so_few_seafaring_jobs_in_australia/,22,11,Australian Fishmeal Company,,commercial vessel,30.78
investing,ni2sjd,Invest like the Norwegian Oil Fund,andrewgreat87,2021-05-21 15:01:14,https://reddit.com/r/investing/comments/ni2sjd/invest_like_the_norwegian_oil_fund/,https://www.reddit.com/r/investing/comments/ni2sjd/invest_like_the_norwegian_oil_fund/,816,201,Akash Fishmeal & Fish Oil Private Limited,,catch,30.41111111111111
Fishing,1l5i9l,Question about catch and release regulations,ImOnTheBus,2013-08-26 18:05:02,https://reddit.com/r/Fishing/comments/1l5i9l/question_about_catch_and_release_regulations/,https://www.reddit.com/r/Fishing/comments/1l5i9l/question_about_catch_and_release_regulations/,7,9,Akash Fishmeal & Fish Oil Private Limited,,catch,29.880000000000003
Fishing,a34hjl,Fishing catch limits & fine/court summons in Quebec,DinaVegas,2018-12-04 13:25:25,https://reddit.com/r/Fishing/comments/a34hjl/fishing_catch_limits_finecourt_summons_in_quebec/,https://www.reddit.com/r/Fishing/comments/a34hjl/fishing_catch_limits_finecourt_summons_in_quebec/,3,9,Akash Fishmeal & Fish Oil Private Limited,,catch,29.72
Fishing,1gfto9a,"rc boat vs rc drone to get your line out, worth it?",worktillyouburk,2024-10-30 12:32:04,https://reddit.com/r/Fishing/comments/1gfto9a/rc_boat_vs_rc_drone_to_get_your_line_out_worth_it/,https://www.reddit.com/r/Fishing/comments/1gfto9a/rc_boat_vs_rc_drone_to_get_your_line_out_worth_it/,0,11,Akash Fishmeal & Fish Oil Private Limited,,catch,28.78888888888889
sustainability,11xnthr,"After Reading IPCC Report, I Put Together Some Positive Climate News",AnonymusWaterBuffalo,2023-03-21 11:26:42,https://reddit.com/r/sustainability/comments/11xnthr/after_reading_ipcc_report_i_put_together_some/,https://www.reddit.com/r/sustainability/comments/11xnthr/after_reading_ipcc_report_i_put_together_some/,140,13,Australian Fishmeal Company,,none,28.644444444444442
investing,v7afrq,"After the precipitous decline, there may be significant value in the Biotech industry",Blondeandblemished,2022-06-07 17:01:45,https://reddit.com/r/investing/comments/v7afrq/after_the_precipitous_decline_there_may_be/,https://www.reddit.com/r/investing/comments/v7afrq/after_the_precipitous_decline_there_may_be/,194,50,Huatai Pharma Inc,,none,28.415555555555557
environment,v5inj,"Australia will create the largest network of marine parks in the world, protecting waters covering an area as large as India while banning oil and gas exploration and limiting commercial fishing in some of the most sensitive areas.",EliphasLevi,2012-06-16 15:23:43,https://reddit.com/r/environment/comments/v5inj/australia_will_create_the_largest_network_of/,http://www.reuters.com/article/2012/06/14/australia-environment-marine-idUSL3E8HE1AO20120614,60,0,Akash Fishmeal & Fish Oil Private Limited,,commercial fishing,28.4
investing,ji0hxs,How to profit off Global Warming: HVAC Market Research with Due Dilligence on 5 Air-Conditioner brands.,StonksArthur,2020-10-25 14:28:12,https://reddit.com/r/investing/comments/ji0hxs/how_to_profit_off_global_warming_hvac_market/,https://www.reddit.com/r/investing/comments/ji0hxs/how_to_profit_off_global_warming_hvac_market/,922,222,Akash Fishmeal & Fish Oil Private Limited,,none,28.1
investing,irhabh,Bloomberg: Nikola’s History of Discrepancies Has Been Hiding in Plain Sight,closingbell,2020-09-12 11:56:06,https://reddit.com/r/investing/comments/irhabh/bloomberg_nikolas_history_of_discrepancies_has/,https://www.reddit.com/r/investing/comments/irhabh/bloomberg_nikolas_history_of_discrepancies_has/,1339,296,Akash Fishmeal & Fish Oil Private Limited,,none,27.622222222222224
Fishing,820afk,Happy Bass day! Shore fishing success with a Texas rigged Yum Genie 'Motor Oil Orange Flake' worm. Catch & release.,FarOutFark,2018-03-04 13:27:03,https://reddit.com/r/Fishing/comments/820afk/happy_bass_day_shore_fishing_success_with_a_texas/,https://i.redd.it/63hdscm03tj01.jpg,22,1,Akash Fishmeal & Fish Oil Private Limited,,catch,27.28
worldnews,rdxug,"It's feared a diesel-loaded trawler wrecked near an Australian marine sanctuary will split, leaking more fuel - Captain's alcohol level was over legal limit. A cargo ship ran into strife nearby Friday.  Dolphins are swimming through oil slicks.  ""There was so much diesel & contaminant.""





",anutensil,2012-03-26 02:14:56,https://reddit.com/r/worldnews/comments/rdxug/its_feared_a_dieselloaded_trawler_wrecked_near_an/,http://www.theage.com.au/environment/conservation/wrecked-trawler-sparks-fuel-fears-20120325-1vsig.html#ixzz1qCwDnsPz,12,2,Akash Fishmeal & Fish Oil Private Limited,,trawler,27.28
maritime,1gndcix,Maritime SAR and Disaster response data needed,Dear_Forever_5212,2024-11-09 09:06:38,https://reddit.com/r/maritime/comments/1gndcix/maritime_sar_and_disaster_response_data_needed/,https://www.reddit.com/r/maritime/comments/1gndcix/maritime_sar_and_disaster_response_data_needed/,1,4,Akash Fishmeal & Fish Oil Private Limited,,none,26.14
investing,g9bz9f,Back to Basics: Real Estate Investing,cooleddy89,2020-04-27 17:28:27,https://reddit.com/r/investing/comments/g9bz9f/back_to_basics_real_estate_investing/,https://www.reddit.com/r/investing/comments/g9bz9f/back_to_basics_real_estate_investing/,468,186,Akash Fishmeal & Fish Oil Private Limited,,none,26.08888888888889
investing,1qwuci,Lecture 1: Types of Assets & Misc. Definitions,I_hate_alot_a_lot,2013-11-18 11:33:15,https://reddit.com/r/investing/comments/1qwuci/lecture_1_types_of_assets_misc_definitions/,https://www.reddit.com/r/investing/comments/1qwuci/lecture_1_types_of_assets_misc_definitions/,645,81,Akash Fishmeal & Fish Oil Private Limited,,none,26.0
news,fge7ve,COVID-19 Megathread #5,RNews_Mod,2020-03-10 07:58:44,https://reddit.com/r/news/comments/fge7ve/covid19_megathread_5/,https://www.reddit.com/r/news/comments/fge7ve/covid19_megathread_5/,1333,9743,Australian Fishmeal Company,,catch,26.0
news,20x264,Comprehensive timeline: Malaysia Airlines Flight 370 PART 14,MH-370-Updates,2014-03-20 11:13:24,https://reddit.com/r/news/comments/20x264/comprehensive_timeline_malaysia_airlines_flight/,https://www.reddit.com/r/news/comments/20x264/comprehensive_timeline_malaysia_airlines_flight/,1352,3922,Australian Fishmeal Company,,none,26.0
news,22avgg,Comprehensive timeline: Malaysia Airlines Flight 370 PART 22,MH-370-Updates,2014-04-05 16:16:29,https://reddit.com/r/news/comments/22avgg/comprehensive_timeline_malaysia_airlines_flight/,https://www.reddit.com/r/news/comments/22avgg/comprehensive_timeline_malaysia_airlines_flight/,856,953,Australian Fishmeal Company,,none,26.0
news,21wlwc,Comprehensive timeline: Malaysia Airlines Flight 370 PART 21,MH-370-Updates,2014-04-01 01:20:42,https://reddit.com/r/news/comments/21wlwc/comprehensive_timeline_malaysia_airlines_flight/,https://www.reddit.com/r/news/comments/21wlwc/comprehensive_timeline_malaysia_airlines_flight/,742,939,Australian Fishmeal Company,,none,26.0
news,21arpx,Comprehensive timeline: Malaysia Airlines Flight 370 PART 17,MH-370-Updates,2014-03-24 23:03:40,https://reddit.com/r/news/comments/21arpx/comprehensive_timeline_malaysia_airlines_flight/,https://www.reddit.com/r/news/comments/21arpx/comprehensive_timeline_malaysia_airlines_flight/,685,995,Australian Fishmeal Company,,none,26.0
news,21kt0d,Comprehensive timeline: Malaysia Airlines Flight 370 PART 19,MH-370-Updates,2014-03-28 01:41:24,https://reddit.com/r/news/comments/21kt0d/comprehensive_timeline_malaysia_airlines_flight/,https://www.reddit.com/r/news/comments/21kt0d/comprehensive_timeline_malaysia_airlines_flight/,688,738,Australian Fishmeal Company,,none,26.0
investing,8rjay1,A friendly reminder of how one man made a killing,kCinvest,2018-06-16 07:20:36,https://reddit.com/r/investing/comments/8rjay1/a_friendly_reminder_of_how_one_man_made_a_killing/,https://www.reddit.com/r/investing/comments/8rjay1/a_friendly_reminder_of_how_one_man_made_a_killing/,692,140,Australian Fishmeal Company,,none,26.0
maritime,1dtv7di,AB limited wanted,silverbk65105,2024-07-02 14:01:22,https://reddit.com/r/maritime/comments/1dtv7di/ab_limited_wanted/,https://www.reddit.com/r/maritime/comments/1dtv7di/ab_limited_wanted/,4,5,Akash Fishmeal & Fish Oil Private Limited,,none,25.215555555555557
Fishing,1ebfpa4,Oak Island NC: Pier & Back Bay Fishing Tips,bbcplanetgirth,2024-07-24 17:16:49,https://reddit.com/r/Fishing/comments/1ebfpa4/oak_island_nc_pier_back_bay_fishing_tips/,https://i.redd.it/zvxtrlarujed1.jpeg,1,4,Akash Fishmeal & Fish Oil Private Limited,,none,24.94
maritime,1e95t6f,Master 1600 GT using Conventional Tug & Barge Tonnage,csheipe757,2024-07-21 22:47:00,https://reddit.com/r/maritime/comments/1e95t6f/master_1600_gt_using_conventional_tug_barge/,https://www.reddit.com/r/maritime/comments/1e95t6f/master_1600_gt_using_conventional_tug_barge/,2,2,Akash Fishmeal & Fish Oil Private Limited,,none,24.157777777777778
Fishing,16vhd65,Help with lake fishing for stocked trout,BigDRummer72,2023-09-29 11:13:15,https://reddit.com/r/Fishing/comments/16vhd65/help_with_lake_fishing_for_stocked_trout/,https://www.reddit.com/r/Fishing/comments/16vhd65/help_with_lake_fishing_for_stocked_trout/,1,9,Akash Fishmeal & Fish Oil Private Limited,,catch,23.61777777777778
investing,1dpr50j,FSD Pharma Receives Ethics Committee Approval for a Phase-1 Multiple Ascending Doses Clinical Trial for Lucid-21-302 (Lucid-MS) in Australia $HUGE ,GalacticMegaHold,2024-06-27 07:21:14,https://reddit.com/r/investing/comments/1dpr50j/fsd_pharma_receives_ethics_committee_approval_for/,https://www.reddit.com/r/investing/comments/1dpr50j/fsd_pharma_receives_ethics_committee_approval_for/,2,1,Huatai Pharma Inc,,none,23.479999999999997
worldnews,1p41qj,Talks to Create World’s 2 Largest Marine Reserves in Antarctic Being Undermined by Last-Ditch Push for “Sunset clause” allowing fishing & oil drilling - Proposal backed by US & NZ would create 1.3m sq km “no take” zone in 1 of last pristine bodies of water in world.,anutensil,2013-10-24 02:22:57,https://reddit.com/r/worldnews/comments/1p41qj/talks_to_create_worlds_2_largest_marine_reserves/,http://www.theguardian.com/world/2013/oct/24/antarctic-marine-reserve-threat-sunset-clause,279,20,Akash Fishmeal & Fish Oil Private Limited,,none,23.16
investing,137j2kz,China Takes the Yuan Global in Bid to Repel a Weaponized Dollar,ourpseudonym,2023-05-04 06:25:39,https://reddit.com/r/investing/comments/137j2kz/china_takes_the_yuan_global_in_bid_to_repel_a/,https://www.reddit.com/r/investing/comments/137j2kz/china_takes_the_yuan_global_in_bid_to_repel_a/,0,12,Akash Fishmeal & Fish Oil Private Limited,,none,23.133333333333333
investing,lr1raa,From Wrigley Chewing Gum —> Gummies (Parallel goes public via $1.9 billion deal),seebz69,2021-02-23 19:49:23,https://reddit.com/r/investing/comments/lr1raa/from_wrigley_chewing_gum_gummies_parallel_goes/,https://www.reddit.com/r/investing/comments/lr1raa/from_wrigley_chewing_gum_gummies_parallel_goes/,173,38,Huatai Pharma Inc,,none,22.364444444444445
Fishing,158gbh4,South Carolina Surf fishing with lures,bobbyg021,2023-07-24 11:00:00,https://reddit.com/r/Fishing/comments/158gbh4/south_carolina_surf_fishing_with_lures/,https://www.reddit.com/r/Fishing/comments/158gbh4/south_carolina_surf_fishing_with_lures/,1,5,Akash Fishmeal & Fish Oil Private Limited,,catch,21.273333333333333
investing,153jlk2,Any tips for analyzing/evaluating oil & gas LP’s?,Theta_is_my_friend,2023-07-18 21:39:43,https://reddit.com/r/investing/comments/153jlk2/any_tips_for_analyzingevaluating_oil_gas_lps/,https://www.reddit.com/r/investing/comments/153jlk2/any_tips_for_analyzingevaluating_oil_gas_lps/,0,4,Akash Fishmeal & Fish Oil Private Limited,,none,20.77777777777778
sustainability,abicrb,Signs of collapse 2018,Dave37,2019-01-01 06:57:28,https://reddit.com/r/sustainability/comments/abicrb/signs_of_collapse_2018/,https://www.reddit.com/r/sustainability/comments/abicrb/signs_of_collapse_2018/,67,13,Akash Fishmeal & Fish Oil Private Limited,,"fisheries, trawler",19.88
investing,k49m6h,"AbCellera's (ABCL) $200mn IPO: Everything You Need to Know about the Peter Thiel-backed, AI-powered, COVID-treatment approved, Biotech Company",BreakwaterResearch,2020-11-30 17:43:11,https://reddit.com/r/investing/comments/k49m6h/abcelleras_abcl_200mn_ipo_everything_you_need_to/,https://www.reddit.com/r/investing/comments/k49m6h/abcelleras_abcl_200mn_ipo_everything_you_need_to/,102,84,Akash Fishmeal & Fish Oil Private Limited,,none,18.58
investing,mm9ppe,Exxon explores sale of elastic polymer business: sources,Equivalent-Branch850,2021-04-07 13:20:42,https://reddit.com/r/investing/comments/mm9ppe/exxon_explores_sale_of_elastic_polymer_business/,https://www.reddit.com/r/investing/comments/mm9ppe/exxon_explores_sale_of_elastic_polymer_business/,62,43,Akash Fishmeal & Fish Oil Private Limited,,none,18.40222222222222
investing,hp9966,The case for a big uranium bull market and what five companies you can invest in to take full advantage of it (updated),3STmotivation,2020-07-11 06:34:26,https://reddit.com/r/investing/comments/hp9966/the_case_for_a_big_uranium_bull_market_and_what/,https://www.reddit.com/r/investing/comments/hp9966/the_case_for_a_big_uranium_bull_market_and_what/,134,139,Australian Fishmeal Company,,none,18.28222222222222
investing,oexebw,Redbubble (ASX: RBL) - My investment thesis and valuation,Shyamallamadingdong,2021-07-06 09:37:04,https://reddit.com/r/investing/comments/oexebw/redbubble_asx_rbl_my_investment_thesis_and/,https://www.reddit.com/r/investing/comments/oexebw/redbubble_asx_rbl_my_investment_thesis_and/,28,18,Australian Fishmeal Company,,none,18.04222222222222
investing,tth665,"Let's peel apart the February 2022 7.9% CPI measurement to figure out if the data shows ""it's because the fed printed money""",waltwhitman83,2022-03-31 21:27:40,https://reddit.com/r/investing/comments/tth665/lets_peel_apart_the_february_2022_79_cpi/,https://www.reddit.com/r/investing/comments/tth665/lets_peel_apart_the_february_2022_79_cpi/,0,9,Akash Fishmeal & Fish Oil Private Limited,,seafood,17.511111111111113
science,7g3o40,"Hi Reddit, I am Terri Woods of East Carolina University. Ask me anything about the aqueous geochemistry and/or using augmented reality to teach surface geology!",AmerChemSocietyAMA,2017-11-28 05:00:22,https://reddit.com/r/science/comments/7g3o40/hi_reddit_i_am_terri_woods_of_east_carolina/,https://www.reddit.com/r/science/comments/7g3o40/hi_reddit_i_am_terri_woods_of_east_carolina/,127,32,Australian Fishmeal Company,,none,17.08
investing,m599as,The Tale of eVTOLs (Tickers of focus: $RTP | $EXPC),sujaykot,2021-03-14 19:14:45,https://reddit.com/r/investing/comments/m599as/the_tale_of_evtols_tickers_of_focus_rtp_expc/,https://www.reddit.com/r/investing/comments/m599as/the_tale_of_evtols_tickers_of_focus_rtp_expc/,24,20,Akash Fishmeal & Fish Oil Private Limited,,landing,16.615555555555556
investing,lpedyn,BioCryst Short-Sellers Lose Control,MarkZhNC,2021-02-21 20:51:12,https://reddit.com/r/investing/comments/lpedyn/biocryst_shortsellers_lose_control/,https://www.reddit.com/r/investing/comments/lpedyn/biocryst_shortsellers_lose_control/,26,30,Huatai Pharma Inc,,none,16.473333333333333
investing,lkldt4,Huge DD on Electric Last Mile Solutions. Only Class 1 EV in the US,Cultural_Dirt,2021-02-15 12:45:13,https://reddit.com/r/investing/comments/lkldt4/huge_dd_on_electric_last_mile_solutions_only/,https://www.reddit.com/r/investing/comments/lkldt4/huge_dd_on_electric_last_mile_solutions_only/,21,46,Akash Fishmeal & Fish Oil Private Limited,,none,16.195555555555554
investing,khzinq,Detailed Assessment of $MP Materials,ThenIJizzedInMyPants,2020-12-21 23:05:40,https://reddit.com/r/investing/comments/khzinq/detailed_assessment_of_mp_materials/,https://www.reddit.com/r/investing/comments/khzinq/detailed_assessment_of_mp_materials/,30,25,Australian Fishmeal Company,,none,15.944444444444443
Fishing,lkb6sd,Rant about Fishing laws in Germany.,Kreisjaegermeister,2021-02-15 03:43:17,https://reddit.com/r/Fishing/comments/lkb6sd/rant_about_fishing_laws_in_germany/,https://www.reddit.com/r/Fishing/comments/lkb6sd/rant_about_fishing_laws_in_germany/,7,15,Akash Fishmeal & Fish Oil Private Limited,,catch,15.635555555555554
technology,7won9d,[Discussion] I attended The Boring Company's Culver City Presentation. I'm concerned about its ability to win public trust.,FUTURESPEAKshow,2018-02-10 15:14:59,https://reddit.com/r/technology/comments/7won9d/discussion_i_attended_the_boring_companys_culver/,https://www.reddit.com/r/technology/comments/7won9d/discussion_i_attended_the_boring_companys_culver/,76,37,Akash Fishmeal & Fish Oil Private Limited,,landing,15.04
sustainability,8w4tvr,Signs of collapse 2018 Q2,Dave37,2018-07-04 14:40:00,https://reddit.com/r/sustainability/comments/8w4tvr/signs_of_collapse_2018_q2/,https://www.reddit.com/r/sustainability/comments/8w4tvr/signs_of_collapse_2018_q2/,71,44,Akash Fishmeal & Fish Oil Private Limited,,none,14.84
sustainability,b8xkdg,Signs of Collapse 2019 Q1,Dave37,2019-04-03 06:53:11,https://reddit.com/r/sustainability/comments/b8xkdg/signs_of_collapse_2019_q1/,https://www.reddit.com/r/sustainability/comments/b8xkdg/signs_of_collapse_2019_q1/,65,15,Akash Fishmeal & Fish Oil Private Limited,,none,14.6
investing,aohq6i,An Introduction To The Cannabis Sector,Meadhead81,2019-02-08 08:41:54,https://reddit.com/r/investing/comments/aohq6i/an_introduction_to_the_cannabis_sector/,https://www.reddit.com/r/investing/comments/aohq6i/an_introduction_to_the_cannabis_sector/,64,30,Akash Fishmeal & Fish Oil Private Limited,,none,14.56
investing,6hpncv,What is stopping Amazon from global domination?,vegaseller,2017-06-16 15:53:38,https://reddit.com/r/investing/comments/6hpncv/what_is_stopping_amazon_from_global_domination/,https://www.reddit.com/r/investing/comments/6hpncv/what_is_stopping_amazon_from_global_domination/,59,61,Australian Fishmeal Company,,none,14.36
investing,b89z94,Investment Hypothesis: The market is fundamentally mis-pricing climate risk and reward.,cooleddy89,2019-04-01 16:06:19,https://reddit.com/r/investing/comments/b89z94/investment_hypothesis_the_market_is_fundamentally/,https://www.reddit.com/r/investing/comments/b89z94/investment_hypothesis_the_market_is_fundamentally/,58,87,Akash Fishmeal & Fish Oil Private Limited,,none,14.32
investing,5p68q1,stockAday: Is Chevron pumping again? $CVX,shane_stockflare,2017-01-20 13:02:56,https://reddit.com/r/investing/comments/5p68q1/stockaday_is_chevron_pumping_again_cvx/,https://www.reddit.com/r/investing/comments/5p68q1/stockaday_is_chevron_pumping_again_cvx/,50,32,Akash Fishmeal & Fish Oil Private Limited,,none,14.0
investing,les1qa,Comprehensive DD on $CTYX: The OTC Biotech Stock of the Decade That Is Being Slept On,charzhar,2021-02-07 11:21:09,https://reddit.com/r/investing/comments/les1qa/comprehensive_dd_on_ctyx_the_otc_biotech_stock_of/,https://www.reddit.com/r/investing/comments/les1qa/comprehensive_dd_on_ctyx_the_otc_biotech_stock_of/,8,11,Akash Fishmeal & Fish Oil Private Limited,,none,13.986666666666666
