subreddit,id,title,author,created_utc,permalink,url,score,num_comments,search_term,snippet,matched_keywords,relevance_score
investing,4siodl,stockAday: A Mastercard in your hand? ($MA),shane_stockflare,2016-07-12 12:51:03,https://reddit.com/r/investing/comments/4siodl/stockaday_a_mastercard_in_your_hand_ma/,https://www.reddit.com/r/investing/comments/4siodl/stockaday_a_mastercard_in_your_hand_ma/,49,39,Akash Fishmeal & Fish Oil Private Limited,,none,13.96
Fishing,powm0f,"LEARN SOMETHNG NEW EVERYDAY! - Fishing in Crater Lake, OR is not only legal without a license, it is encouraged!!",ZOODUDE100,2021-09-15 13:03:50,https://reddit.com/r/Fishing/comments/powm0f/learn_somethng_new_everyday_fishing_in_crater/,https://www.reddit.com/r/Fishing/comments/powm0f/learn_somethng_new_everyday_fishing_in_crater/,13,3,Akash Fishmeal & Fish Oil Private Limited,,catch,13.43111111111111
investing,54n3qe,stockAday: you been had by Gilead? ($GILD),shane_stockflare,2016-09-26 15:41:43,https://reddit.com/r/investing/comments/54n3qe/stockaday_you_been_had_by_gilead_gild/,https://www.reddit.com/r/investing/comments/54n3qe/stockaday_you_been_had_by_gilead_gild/,35,17,Huatai Pharma Inc,,none,13.4
Fishing,njenoc,A question about legal size and private property,Mojo884ever,2021-05-23 13:07:23,https://reddit.com/r/Fishing/comments/njenoc/a_question_about_legal_size_and_private_property/,https://www.reddit.com/r/Fishing/comments/njenoc/a_question_about_legal_size_and_private_property/,1,7,Akash Fishmeal & Fish Oil Private Limited,,catch,13.273333333333333
Fishing,1ssjfe,Electrofishing: How does it work and what is it used for.,mrfish1991,2013-12-13 05:47:41,https://reddit.com/r/Fishing/comments/1ssjfe/electrofishing_how_does_it_work_and_what_is_it/,https://www.reddit.com/r/Fishing/comments/1ssjfe/electrofishing_how_does_it_work_and_what_is_it/,30,24,Akash Fishmeal & Fish Oil Private Limited,,fisheries,13.2
investing,dolxx1,IMO2020 is the most important investing theme of the decade,calvinfroedge,2019-10-29 00:24:07,https://reddit.com/r/investing/comments/dolxx1/imo2020_is_the_most_important_investing_theme_of/,https://www.reddit.com/r/investing/comments/dolxx1/imo2020_is_the_most_important_investing_theme_of/,23,16,Akash Fishmeal & Fish Oil Private Limited,,none,12.92
Fishing,l5jgrd,"Spotted trout, red fish & snook help",Legendary__Beaver,2021-01-26 10:58:41,https://reddit.com/r/Fishing/comments/l5jgrd/spotted_trout_red_fish_snook_help/,https://www.reddit.com/r/Fishing/comments/l5jgrd/spotted_trout_red_fish_snook_help/,3,9,Akash Fishmeal & Fish Oil Private Limited,,catch,12.853333333333332
sustainability,r0lobg,Protest the exploration of oil and gas reserves on South Africa's aptly named Wild Coast,totally_k,2021-11-23 12:55:22,https://reddit.com/r/sustainability/comments/r0lobg/protest_the_exploration_of_oil_and_gas_reserves/,https://www.reddit.com/r/sustainability/comments/r0lobg/protest_the_exploration_of_oil_and_gas_reserves/,9,0,NuBlend Pty Ltd,,none,12.837777777777777
business,pmtymj,Network effects as value creation tools | part 2,arash_param,2021-09-12 08:45:00,https://reddit.com/r/business/comments/pmtymj/network_effects_as_value_creation_tools_part_2/,https://www.reddit.com/r/business/comments/pmtymj/network_effects_as_value_creation_tools_part_2/,3,2,Akash Fishmeal & Fish Oil Private Limited,,none,12.597777777777777
sustainability,9kgefn,Signs of collapse 2018 q3,Dave37,2018-10-01 07:39:14,https://reddit.com/r/sustainability/comments/9kgefn/signs_of_collapse_2018_q3/,https://www.reddit.com/r/sustainability/comments/9kgefn/signs_of_collapse_2018_q3/,14,0,Akash Fishmeal & Fish Oil Private Limited,,"fisheries, trawler",12.56
Fishing,27s7ey,Going to Minnesota in about a week- need some advice for muskies. (warning- lots of info on lake I am going to),CampBenCh,2014-06-10 07:13:54,https://reddit.com/r/Fishing/comments/27s7ey/going_to_minnesota_in_about_a_week_need_some/,https://www.reddit.com/r/Fishing/comments/27s7ey/going_to_minnesota_in_about_a_week_need_some/,5,24,Akash Fishmeal & Fish Oil Private Limited,,catch,12.2
investing,nybxac,"Let's Discuss: the Risk Factor Summation Valuation Method, Pt 2",AnInvestmentsDude,2021-06-12 11:34:13,https://reddit.com/r/investing/comments/nybxac/lets_discuss_the_risk_factor_summation_valuation/,https://www.reddit.com/r/investing/comments/nybxac/lets_discuss_the_risk_factor_summation_valuation/,8,2,Akash Fishmeal & Fish Oil Private Limited,,none,11.775555555555556
investing,fgzool,Basket of Covid-19 vaccine developers,rpsglobal_9,2020-03-11 10:17:23,https://reddit.com/r/investing/comments/fgzool/basket_of_covid19_vaccine_developers/,https://www.reddit.com/r/investing/comments/fgzool/basket_of_covid19_vaccine_developers/,5,12,Huatai Pharma Inc,,none,11.0
environment,k1z2jh,The Dangers of Veganism and Renewable Energy,Megalomaniacal-Freak,2020-11-27 03:51:31,https://reddit.com/r/environment/comments/k1z2jh/the_dangers_of_veganism_and_renewable_energy/,https://www.reddit.com/r/environment/comments/k1z2jh/the_dangers_of_veganism_and_renewable_energy/,0,5,Akash Fishmeal & Fish Oil Private Limited,,none,10.466666666666665
Fishing,kxpe3y,"LBC & Orange County Anglers, how’s the bite been?? (Land Based/On foot)",angrypnutbutter23,2021-01-15 00:09:51,https://reddit.com/r/Fishing/comments/kxpe3y/lbc_orange_county_anglers_hows_the_bite_been_land/,https://www.reddit.com/r/Fishing/comments/kxpe3y/lbc_orange_county_anglers_hows_the_bite_been_land/,3,3,Akash Fishmeal & Fish Oil Private Limited,,catch,10.331111111111111
worldnews,98k4ku,Russian oil industry would weather U.S. 'bill from hell' - Stiff new US sanctions would only have a limited impact on its oil industry because it's drastically reduced its reliance on Western funding & foreign partnerships & is lessening its dependence on imported technology.,anutensil,2018-08-19 07:10:17,https://reddit.com/r/worldnews/comments/98k4ku/russian_oil_industry_would_weather_us_bill_from/,https://www.reuters.com/article/us-russia-oil-sanctions-analysis/russian-oil-industry-would-weather-u-s-bill-from-hell-idUSKBN1L20GY,32,7,Akash Fishmeal & Fish Oil Private Limited,,none,10.08
worldnews,4bcred,Ecuador creates Galápagos marine sanctuary to protect sharks - Belgium-sized area around northern islands of Darwin & Wolf will be off-limits for fishing in bid to conserve sharks & unique habitat,anutensil,2016-03-21 09:40:13,https://reddit.com/r/worldnews/comments/4bcred/ecuador_creates_galápagos_marine_sanctuary_to/,http://www.theguardian.com/environment/2016/mar/21/ecuador-creates-galapagos-marine-sanctuary-to-protect-sharks,35,6,Akash Fishmeal & Fish Oil Private Limited,,none,9.8
environment,6296uv,Things we can do on an individual level.,EpilepticDogs,2017-03-29 14:21:22,https://reddit.com/r/environment/comments/6296uv/things_we_can_do_on_an_individual_level/,https://www.reddit.com/r/environment/comments/6296uv/things_we_can_do_on_an_individual_level/,6,8,Akash Fishmeal & Fish Oil Private Limited,,seafood,9.440000000000001
business,lnkylr,"Sustainablism: Once you know what it is, you're going to want it.",Harold_B1927,2021-02-19 10:09:08,https://reddit.com/r/business/comments/lnkylr/sustainablism_once_you_know_what_it_is_youre/,https://www.reddit.com/r/business/comments/lnkylr/sustainablism_once_you_know_what_it_is_youre/,0,0,Akash Fishmeal & Fish Oil Private Limited,,none,9.399999999999999
investing,8y6lbt,Lithium Battery Boom,Gazola,2018-07-11 22:18:51,https://reddit.com/r/investing/comments/8y6lbt/lithium_battery_boom/,https://www.reddit.com/r/investing/comments/8y6lbt/lithium_battery_boom/,0,8,Australian Fishmeal Company,,none,9.2
investing,a7dbyx,Old Fortune article on Jeffrey Gundlach. It’s a fun read.,FunctionOfLife,2018-12-18 10:47:56,https://reddit.com/r/investing/comments/a7dbyx/old_fortune_article_on_jeffrey_gundlach_its_a_fun/,https://www.reddit.com/r/investing/comments/a7dbyx/old_fortune_article_on_jeffrey_gundlach_its_a_fun/,3,7,Akash Fishmeal & Fish Oil Private Limited,,none,8.92
investing,9l24hr,$ALKS - Alkermes DD,Chill_Duck_,2018-10-03 09:22:48,https://reddit.com/r/investing/comments/9l24hr/alks_alkermes_dd/,https://www.reddit.com/r/investing/comments/9l24hr/alks_alkermes_dd/,3,6,Akash Fishmeal & Fish Oil Private Limited,,none,8.52
Fishing,1rbyt9,"Calling all Landowners, Farmers, Ranchers, Hunters and Anglers",OPN2013,2013-11-23 21:47:14,https://reddit.com/r/Fishing/comments/1rbyt9/calling_all_landowners_farmers_ranchers_hunters/,https://www.reddit.com/r/Fishing/comments/1rbyt9/calling_all_landowners_farmers_ranchers_hunters/,20,4,Akash Fishmeal & Fish Oil Private Limited,,none,8.4
environment,jktdsc,Nothing To See Here = Runaway Hothouse Mass Extinction,Right_Ad5056,2020-10-30 03:06:58,https://reddit.com/r/environment/comments/jktdsc/nothing_to_see_here_runaway_hothouse_mass/,https://www.reddit.com/r/environment/comments/jktdsc/nothing_to_see_here_runaway_hothouse_mass/,6,0,Akash Fishmeal & Fish Oil Private Limited,,none,8.395555555555555
environment,jic82x,Situational Awareness,Right_Ad5056,2020-10-26 04:37:12,https://reddit.com/r/environment/comments/jic82x/situational_awareness/,https://www.reddit.com/r/environment/comments/jic82x/situational_awareness/,6,0,Akash Fishmeal & Fish Oil Private Limited,,none,8.351111111111111
investing,58r5om,How Investors Should Deal With The Overwhelming Problem Of Understanding The World Economy,vkatsenelson,2016-10-21 20:39:09,https://reddit.com/r/investing/comments/58r5om/how_investors_should_deal_with_the_overwhelming/,https://www.reddit.com/r/investing/comments/58r5om/how_investors_should_deal_with_the_overwhelming/,2,5,Akash Fishmeal & Fish Oil Private Limited,,none,8.08
investing,bwdibo,LYNAS - Rare earth mineral play,Nicodemus985,2019-06-03 11:40:31,https://reddit.com/r/investing/comments/bwdibo/lynas_rare_earth_mineral_play/,https://www.reddit.com/r/investing/comments/bwdibo/lynas_rare_earth_mineral_play/,1,5,Australian Fishmeal Company,,none,8.04
investing,8cznkn,self-driving car ideas,sfriendlydragon,2018-04-17 14:13:42,https://reddit.com/r/investing/comments/8cznkn/selfdriving_car_ideas/,https://www.reddit.com/r/investing/comments/8cznkn/selfdriving_car_ideas/,0,5,Akash Fishmeal & Fish Oil Private Limited,,none,8.0
investing,58bzqw,"stockAday: A complete unknown, like a BlackStone? $BX",shane_stockflare,2016-10-19 12:44:24,https://reddit.com/r/investing/comments/58bzqw/stockaday_a_complete_unknown_like_a_blackstone_bx/,https://www.reddit.com/r/investing/comments/58bzqw/stockaday_a_complete_unknown_like_a_blackstone_bx/,6,4,Akash Fishmeal & Fish Oil Private Limited,,none,7.84
investing,4r7zor,stockAday: Mohawk might be mighty? ($MHK),shane_stockflare,2016-07-04 10:33:23,https://reddit.com/r/investing/comments/4r7zor/stockaday_mohawk_might_be_mighty_mhk/,https://www.reddit.com/r/investing/comments/4r7zor/stockaday_mohawk_might_be_mighty_mhk/,14,3,Akash Fishmeal & Fish Oil Private Limited,,none,7.760000000000001
investing,i8zjn0,"Cord Blood Banking, our thoughts",InfiniteValueptr,2020-08-13 07:04:40,https://reddit.com/r/investing/comments/i8zjn0/cord_blood_banking_our_thoughts/,https://www.reddit.com/r/investing/comments/i8zjn0/cord_blood_banking_our_thoughts/,1,1,Akash Fishmeal & Fish Oil Private Limited,,none,7.728888888888888
Fishing,3giahv,Clearwater beach Florida- vacation,Imthaschmidt,2015-08-10 14:34:15,https://reddit.com/r/Fishing/comments/3giahv/clearwater_beach_florida_vacation/,https://www.reddit.com/r/Fishing/comments/3giahv/clearwater_beach_florida_vacation/,1,4,Akash Fishmeal & Fish Oil Private Limited,,none,7.640000000000001
Fishing,ccbtfk,Considering A First Boat,pm_me_Freeland_pics,2019-07-12 08:50:22,https://reddit.com/r/Fishing/comments/ccbtfk/considering_a_first_boat/,https://www.reddit.com/r/Fishing/comments/ccbtfk/considering_a_first_boat/,6,3,Akash Fishmeal & Fish Oil Private Limited,,none,7.44
investing,5rwh0b,stockAday: how far for Univar? $UNVR,shane_stockflare,2017-02-03 13:50:25,https://reddit.com/r/investing/comments/5rwh0b/stockaday_how_far_for_univar_unvr/,https://www.reddit.com/r/investing/comments/5rwh0b/stockaday_how_far_for_univar_unvr/,4,3,Akash Fishmeal & Fish Oil Private Limited,,none,7.36
investing,24hoov,"NASDAQ:EROC – Eagle Rock Energy Partners - a quintessential ""death-spiral"" company!",FatPitch,2014-05-01 15:46:59,https://reddit.com/r/investing/comments/24hoov/nasdaqeroc_eagle_rock_energy_partners_a/,https://www.reddit.com/r/investing/comments/24hoov/nasdaqeroc_eagle_rock_energy_partners_a/,1,3,Akash Fishmeal & Fish Oil Private Limited,,processing plant,7.24
Fishing,1jwes8,Walleye fishing on North Manistique Lake (round lake),ovar,2013-08-07 12:33:05,https://reddit.com/r/Fishing/comments/1jwes8/walleye_fishing_on_north_manistique_lake_round/,https://www.reddit.com/r/Fishing/comments/1jwes8/walleye_fishing_on_north_manistique_lake_round/,3,2,Akash Fishmeal & Fish Oil Private Limited,,catch,6.92
investing,6a8d6k,stockAday: what's the diagnosis on Opko? $OPK,shane_stockflare,2017-05-09 15:19:54,https://reddit.com/r/investing/comments/6a8d6k/stockaday_whats_the_diagnosis_on_opko_opk/,https://www.reddit.com/r/investing/comments/6a8d6k/stockaday_whats_the_diagnosis_on_opko_opk/,3,2,Huatai Pharma Inc,,none,6.92
environment,hlkrwz,The Demasculation Sterilization And Feminization Of Males Across All Vertebrate Classes,rrrrrriiiiiiiiiiippp,2020-07-05 04:56:58,https://reddit.com/r/environment/comments/hlkrwz/the_demasculation_sterilization_and_feminization/,https://www.reddit.com/r/environment/comments/hlkrwz/the_demasculation_sterilization_and_feminization/,1,0,Akash Fishmeal & Fish Oil Private Limited,,seafood,6.895555555555554
environment,6yny1x,DRINKING WATER RISK eWATER solution – position paper,zerroxyz,2017-09-07 09:32:07,https://reddit.com/r/environment/comments/6yny1x/drinking_water_risk_ewater_solution_position_paper/,https://www.reddit.com/r/environment/comments/6yny1x/drinking_water_risk_ewater_solution_position_paper/,1,2,Akash Fishmeal & Fish Oil Private Limited,,none,6.84
investing,37luu6,How to Conduct Due Diligence in China,Plexus-Investigation,2015-05-28 09:54:42,https://reddit.com/r/investing/comments/37luu6/how_to_conduct_due_diligence_in_china/,https://www.reddit.com/r/investing/comments/37luu6/how_to_conduct_due_diligence_in_china/,0,2,Akash Fishmeal & Fish Oil Private Limited,,none,6.8
technology,1ojkfg,"Drone Service Delivers Textbooks to Students in Minutes:Australian textbook rental company Zookal has partnered with Flirtey, a commercial drone service, to ship some Australian students their books just minutes after they place an order.",jasmine1a,2013-10-15 19:23:31,https://reddit.com/r/technology/comments/1ojkfg/drone_service_delivers_textbooks_to_students_in/,http://mashable.com/2013/10/15/drones-deliver-textbooks/,0,2,Australian Fishmeal Company,,none,6.8
environment,68ydgt,Vegetarianism and the Global Environment,VegetarianPerson,2017-05-02 23:03:15,https://reddit.com/r/environment/comments/68ydgt/vegetarianism_and_the_global_environment/,https://www.reddit.com/r/environment/comments/68ydgt/vegetarianism_and_the_global_environment/,8,1,Akash Fishmeal & Fish Oil Private Limited,,none,6.720000000000001
environment,6aobac,An article on plastics,Tehlinky4,2017-05-11 19:09:22,https://reddit.com/r/environment/comments/6aobac/an_article_on_plastics/,https://www.reddit.com/r/environment/comments/6aobac/an_article_on_plastics/,5,1,Australian Fishmeal Company,,none,6.6000000000000005
environment,8e30yd,Why Emissions MUST Go Down 100X Times Faster Than Now !!!,CommonEmployment,2018-04-22 06:47:13,https://reddit.com/r/environment/comments/8e30yd/why_emissions_must_go_down_100x_times_faster_than/,https://www.reddit.com/r/environment/comments/8e30yd/why_emissions_must_go_down_100x_times_faster_than/,15,0,Akash Fishmeal & Fish Oil Private Limited,,none,6.6
environment,42r3in,Emergency Alert - No Soil & Water Before 100% Renewable Energy,sdafjaw,2016-01-26 04:29:43,https://reddit.com/r/environment/comments/42r3in/emergency_alert_no_soil_water_before_100/,https://www.reddit.com/r/environment/comments/42r3in/emergency_alert_no_soil_water_before_100/,2,1,Akash Fishmeal & Fish Oil Private Limited,,none,6.48
Fishing,28j3di,Quarry Fishing help?,IanPBoyd,2014-06-19 00:04:38,https://reddit.com/r/Fishing/comments/28j3di/quarry_fishing_help/,https://www.reddit.com/r/Fishing/comments/28j3di/quarry_fishing_help/,1,1,Akash Fishmeal & Fish Oil Private Limited,,catch,6.44
environment,g9n4ob,Food Is God: James Hansen's Plan To Save Life On Earth,CommonEmployment2,2020-04-28 07:25:16,https://reddit.com/r/environment/comments/g9n4ob/food_is_god_james_hansens_plan_to_save_life_on/,https://www.reddit.com/r/environment/comments/g9n4ob/food_is_god_james_hansens_plan_to_save_life_on/,6,0,Akash Fishmeal & Fish Oil Private Limited,,none,6.340000000000002
environment,2ws2de,"TIL: 1.1 million gallons of crude oil spilled in rail accidents in 2013. 9,500 rail cars carried crude oil in 2008. 400,000+ rail cars carried crude oil in 2013.",theoriginalauthor,2015-02-22 11:08:32,https://reddit.com/r/environment/comments/2ws2de/til_11_million_gallons_of_crude_oil_spilled_in/,https://www.reddit.com/r/environment/comments/2ws2de/til_11_million_gallons_of_crude_oil_spilled_in/,8,0,Akash Fishmeal & Fish Oil Private Limited,,none,6.32
investing,atibzw,2019-02-22 Morning News Feed,finfeed,2019-02-22 07:40:03,https://reddit.com/r/investing/comments/atibzw/20190222_morning_news_feed/,https://www.reddit.com/r/investing/comments/atibzw/20190222_morning_news_feed/,4,0,Australian Fishmeal Company,,none,6.16
business,7l36kf,My Reason To Invest in & Analysis on TokenPay ICO (1st Anon Crypto with a Bank),PIQAS,2017-12-20 11:12:13,https://reddit.com/r/business/comments/7l36kf/my_reason_to_invest_in_analysis_on_tokenpay_ico/,https://www.reddit.com/r/business/comments/7l36kf/my_reason_to_invest_in_analysis_on_tokenpay_ico/,2,0,Akash Fishmeal & Fish Oil Private Limited,,none,6.08
business,4rkkca,[Discussion] Blue Ocean Strategy and large B2B corporations,randomdent42,2016-07-06 14:24:51,https://reddit.com/r/business/comments/4rkkca/discussion_blue_ocean_strategy_and_large_b2b/,https://www.reddit.com/r/business/comments/4rkkca/discussion_blue_ocean_strategy_and_large_b2b/,2,0,Australian Fishmeal Company,,catch,6.08
technology,370bij,X-Post from r/privacy/: Data Use Agreements for Individuals,SDedaluz,2015-05-23 11:56:24,https://reddit.com/r/technology/comments/370bij/xpost_from_rprivacy_data_use_agreements_for/,https://www.reddit.com/r/technology/comments/370bij/xpost_from_rprivacy_data_use_agreements_for/,0,0,Akash Fishmeal & Fish Oil Private Limited,,none,6.0
investing,1cv8st,Can Equities Cushion the Blow of Falling Gold Prices?: Peter Rose,mikerodger,2013-04-22 09:29:20,https://reddit.com/r/investing/comments/1cv8st/can_equities_cushion_the_blow_of_falling_gold/,https://www.reddit.com/r/investing/comments/1cv8st/can_equities_cushion_the_blow_of_falling_gold/,0,0,Akash Fishmeal & Fish Oil Private Limited,,none,6.0
business,8rzvf9,"Advisor of the Australian Government discusses selling his startup and what the government looks for in granting their ""Accelerating Commercialisation"" funding.",DoubleLifeMike,2018-06-18 08:21:36,https://reddit.com/r/business/comments/8rzvf9/advisor_of_the_australian_government_discusses/,https://www.reddit.com/r/business/comments/8rzvf9/advisor_of_the_australian_government_discusses/,0,0,Australian Fishmeal Company,,none,6.0
investing,197380,3 Australian Rare Earth Companies Worth Watching,mikerodger,2013-02-25 09:00:22,https://reddit.com/r/investing/comments/197380/3_australian_rare_earth_companies_worth_watching/,https://www.reddit.com/r/investing/comments/197380/3_australian_rare_earth_companies_worth_watching/,0,0,Australian Fishmeal Company,,none,6.0
science,32sn8d,"Science AMA Series: We're scientists on a NOAA ocean exploration mission to uncover the deepest, unseen parts of the Caribbean Sea. Ask Us Anything!",NOAAgov,2015-04-16 05:49:50,https://reddit.com/r/science/comments/32sn8d/science_ama_series_were_scientists_on_a_noaa/,https://www.reddit.com/r/science/comments/32sn8d/science_ama_series_were_scientists_on_a_noaa/,4931,913,andrea,"We are Andrea Quattrini (deep-sea biologist, U.S. Geological Survey), Mike Cheadle (geologist, University of Wyom",fisheries,26.0
Fishing,iir88,SPI/Port Isabel fishing,physicsking,2011-07-06 22:47:46,https://reddit.com/r/Fishing/comments/iir88/spiport_isabel_fishing/,https://www.reddit.com/r/Fishing/comments/iir88/spiport_isabel_fishing/,2,0,isabel,,none,6.08
investing,mc095v,Best stocks for the fourth industrial revolution,SnooObjections2665,2021-03-24 01:48:19,https://reddit.com/r/investing/comments/mc095v/best_stocks_for_the_fourth_industrial_revolution/,https://www.reddit.com/r/investing/comments/mc095v/best_stocks_for_the_fourth_industrial_revolution/,545,188,austral group saa,,none,29.766666666666666
investing,kfuc0v,5 IPOs to watch for in 2021,tadhg8811,2020-12-18 14:42:13,https://reddit.com/r/investing/comments/kfuc0v/5_ipos_to_watch_for_in_2021/,https://www.reddit.com/r/investing/comments/kfuc0v/5_ipos_to_watch_for_in_2021/,607,227,austral group saa,,catch,28.7
investing,1ig7kkb,ASPI DD - In it for the Long-Term,t-hawk5,2025-02-02 14:00:50,https://reddit.com/r/investing/comments/1ig7kkb/aspi_dd_in_it_for_the_longterm/,https://www.reddit.com/r/investing/comments/1ig7kkb/aspi_dd_in_it_for_the_longterm/,0,2,ger export sa,,none,26.244444444444444
investing,137j2kz,China Takes the Yuan Global in Bid to Repel a Weaponized Dollar,ourpseudonym,2023-05-04 06:25:39,https://reddit.com/r/investing/comments/137j2kz/china_takes_the_yuan_global_in_bid_to_repel_a/,https://www.reddit.com/r/investing/comments/137j2kz/china_takes_the_yuan_global_in_bid_to_repel_a/,0,12,ger export sa,,none,23.133333333333333
investing,lbzmoi,$TAKOF - Drone Delivery Canada DD,Invnsbl123,2021-02-03 15:03:07,https://reddit.com/r/investing/comments/lbzmoi/takof_drone_delivery_canada_dd/,https://www.reddit.com/r/investing/comments/lbzmoi/takof_drone_delivery_canada_dd/,115,57,austral group saa,,none,19.822222222222223
investing,p6qxx8,DOCN: An under-appreciated tech infrastructure company?,WinstonP18,2021-08-18 07:15:51,https://reddit.com/r/investing/comments/p6qxx8/docn_an_underappreciated_tech_infrastructure/,https://www.reddit.com/r/investing/comments/p6qxx8/docn_an_underappreciated_tech_infrastructure/,16,25,austral group saa,,none,18.04
investing,lc0rzo,Drone Delivery Canada * $TAKOF * DD [10X UPSIDE],HX_10,2021-02-03 15:55:07,https://reddit.com/r/investing/comments/lc0rzo/drone_delivery_canada_takof_dd_10x_upside/,https://www.reddit.com/r/investing/comments/lc0rzo/drone_delivery_canada_takof_dd_10x_upside/,42,22,austral group saa,,none,16.90222222222222
investing,lcs7hd,Investment DD: Payoneer (FTOC),sorengard123,2021-02-04 15:35:13,https://reddit.com/r/investing/comments/lcs7hd/investment_dd_payoneer_ftoc/,https://www.reddit.com/r/investing/comments/lcs7hd/investment_dd_payoneer_ftoc/,20,18,pacific freezing company sac,,none,16.033333333333335
investing,6d5fu8,stockAday: hungry for Tyson? $TSN,shane_stockflare,2017-05-24 16:10:53,https://reddit.com/r/investing/comments/6d5fu8/stockaday_hungry_for_tyson_tsn/,https://www.reddit.com/r/investing/comments/6d5fu8/stockaday_hungry_for_tyson_tsn/,53,23,ger export sa,,none,14.120000000000001
investing,5p68q1,stockAday: Is Chevron pumping again? $CVX,shane_stockflare,2017-01-20 13:02:56,https://reddit.com/r/investing/comments/5p68q1/stockaday_is_chevron_pumping_again_cvx/,https://www.reddit.com/r/investing/comments/5p68q1/stockaday_is_chevron_pumping_again_cvx/,52,32,ger export sa,,none,14.08
investing,45w3bg,Iran ships first oil to Europe in 3 years,SueBid,2016-02-15 04:39:11,https://reddit.com/r/investing/comments/45w3bg/iran_ships_first_oil_to_europe_in_3_years/,https://www.reddit.com/r/investing/comments/45w3bg/iran_ships_first_oil_to_europe_in_3_years/,36,17,ger export sa,,none,13.44
business,bo04cu,"It Turns Out Millennials Aren’t Ruining Everything: How Avocado Toast, Wigs and Cashew are Transforming Africa’s Economy",gnikivar2,2019-05-13 00:55:47,https://reddit.com/r/business/comments/bo04cu/it_turns_out_millennials_arent_ruining_everything/,https://www.reddit.com/r/business/comments/bo04cu/it_turns_out_millennials_arent_ruining_everything/,0,1,ger export sa,,none,6.4
business,93rji3,Clarification on business vs entrepreneur,supalist,2018-08-01 12:22:04,https://reddit.com/r/business/comments/93rji3/clarification_on_business_vs_entrepreneur/,https://www.reddit.com/r/business/comments/93rji3/clarification_on_business_vs_entrepreneur/,1,0,austral group saa,,none,6.04
environment,2cth8h,Make Fuel Not Cancer,photosinger,2014-08-06 14:11:03,https://reddit.com/r/environment/comments/2cth8h/make_fuel_not_cancer/,https://www.reddit.com/r/environment/comments/2cth8h/make_fuel_not_cancer/,1,0,austral group saa,,none,6.04
